{
  "schema_version": "apr_run_ledger.v1",
  "workflow": "fcp-review",
  "round": 1,
  "slug": "apr-fcp-review-r1-abcd",
  "run_id": "01HZW8XK0K0K0K0K0K0K0K0K01",
  "started_at": "2026-05-12T18:00:00Z",
  "finished_at": null,
  "duration_ms": null,
  "state": "started",
  "files": [
    {
      "path": "README.md",
      "basename": "README.md",
      "bytes": 5420,
      "sha256": "e3b0c44298fc1c149afbf4c8996fb92427ae41e4649b934ca495991b7852b855",
      "inclusion_reason": "required"
    }
  ],
  "prompt_hash": "0123456789abcdef0123456789abcdef0123456789abcdef0123456789abcdef",
  "oracle": {
    "engine": "browser",
    "model": "5.2 Thinking"
  },
  "outcome": {
    "ok": false,
    "code": "started"
  },
  "execution": {
    "retries_count": 0,
    "busy_wait_count": 0,
    "busy_wait_total_ms": 0
  }
}
